,title,subreddit
885,I cause most of my problems myself,depression
886,Sometimes specific smells or sounds or temperature can remind me of a bad time and send me straight into an episode,depression
887,I dont know what triggered my depression.,depression
888,I'm just tired...,depression
889,It sucks when you have just one or two friends who have a much larger friend circle that you are not a part of.,depression
890,Would it be wrong to kill myself?,depression
891,Don’t want to get better but still feel hopeless,depression
892,Its really cool how I have to pay someone to care about me.,depression
893,Monday’s are the ones with highest suicide rates,depression
894,I cut myself for the first time in seven years.,depression
895,"I'm helping to organise a company wide mental health awareness week for suicide awareness, and want your input to help others in the same situation.",depression
896,I just need to tell someone,depression
897,I feel worthless,depression
898,can't process death,depression
899,Bad day.,depression
900,My grandma is dying,depression
901,"Is my depression ""reasonable"" considering the circumstances? (male 26)",depression
902,Does anyone else struggle with panic attacks?,depression
903,Im not even sure if im depressed,depression
904,It's ironic. I simultaneously feel like a burden being alive and feel like my suicide would be a burden too.,depression
905,Kill. Me.,depression
906,Man up,depression
907,Work sucks.,depression
908,I was doing so well... Now it claws at my bones to come back,depression
909,It's scary how comfortable I've become.,depression
910,I feel it coming back,depression
911,Coping and Help,depression
912,Decided to post,depression
913,I Don't know how to keep going,depression
914,Am i fucking myself up even more?,depression
915,Is it normal that i feel sad whenever i see that my mom is sad?,depression
916,Life is worthless,depression
917,Does anyone else get really annoyed and angry at your mom or dad? And feel guilty after?,depression
918,"It’s like Courtney Barnett is in my head, are you thinking the same thing? (Her song “Everybody here hates you.”)",depression
919,"I'm almost 30, haven't worked in 3 years, no car, no license, no friends, limited amount of money &amp; will be homeless soon...",depression
920,How do I get help ?,depression
921,[NSFW?] How do you cope with low libido (especially while being medicated)?,depression
922,Why do i keep chasing. I end up falling anyways.,depression
923,Trapped in prison,depression
924,What's the point?,depression
925,I’m in so much pain rn. I’ve slept all weekend and I’m not tired enough to sleep it off. I don’t know what to do.,depression
926,How Neon Genesis Evangelion helped my recovery,depression
927,Annoying friends,depression
928,It’s happening again,depression
929,Pics,depression
930,Please help me,depression
931,First ever thoughts about ending it for real,depression
932,How can i deal with rejection,depression
933,My bunny passed away and I feel like absolute hell,depression
934,This world is broken,depression
935,My wife of 4 years (6 years total) left me for a woman. It's been 6 months and 10 days. I still feel like shit. Any advise?,depression
936,Guys please how do I make it go away,depression
937,Just listened to kanye talk about bp on letterman,depression
938,I hate myself and everyone else,depression
939,Just typ something down here,depression
940,I don’t enjoy anything anymore.,depression
941,I don't know how to talk to my friends about my mental health,depression
942,"I am a normal person, just like everyone else. I just got a mask infront of my face to hide the monster that is my depression",depression
943,Dissociated af lately,depression
944,Life turned to shit,depression
945,how do you know you’re getting bad again?,depression
946,i feel purposeless/empty/worthless and i have no personality or friends i have nothing no skills. Im pathetic and sad. No one likes me. Im sooo boring. How do i stop chasing others approval/attention? How do i being a boring/bland nice guy??,depression
947,What do you do when therapy and taking care of yourself doesn't help?,depression
948,I feel like i want to detach from my friends and from people i know.,depression
949,Soon I'll be out of school and never back again,depression
950,"All I wanna do is sleep, all day, every day",depression
951,I thought i was finally happy but it all came back..,depression
952,Fell into a pit,depression
953,I need help,depression
954,Depressed mom,depression
955,Coping for depression,depression
956,I don't feel like I want people to make me happy,depression
957,closing a dark chapter of my life,depression
958,Completely given up on socializing,depression
959,Existence is mostly shit,depression
960,Dead inside.......,depression
961,I Give Up,depression
962,Am I fucked up,depression
963,Happiness seems like a task to teraform mars,depression
964,Some days I have to speak,depression
965,I fuking quit,depression
966,Experiences with Sertraline,depression
967,I am too wierd and it is not getting better.,depression
968,"Anyone else feel like they're a time bomb, not even sure if/when you'll explode?",depression
969,"I stopped talking,(social media posts, texting etc) and reaching out for connections(hangouts etc) because ones seemed to brush me off, and new potential friendships have me anxious they will let go and forget me too.",depression
970,I don't know how to kill myself,depression
971,Letters to my ex now I realise the shit I did.,depression
972,How do I know if I’m really depressed?,depression
973,Cruel World (my own work),depression
974,a hot mess express,depression
975,kinda just need to vent,depression
976,I don't know who I am to the point that I don't even know what I want to buy myself for my birthday,depression
977,Im scared,depression
978,i kind of just need to vent.,depression
979,Disappear,depression
980,"Don't want to know myself anymore, I'm ready to join the stars",depression
981,Long time Depressed &amp; not sure if my partner is right for me? Confused,depression
982,Old loser,depression
983,I feel bad for having depression,depression
984,I feel trapped,depression
985,i need help,depression
986,Daily momentary pits of desperation,depression
987,"Does anyone else get really happy and motivated for a few hours to a few days, just to fall off the edge again?",depression
988,I’ve noticed that I feel better about myself/ relief after purposely hurting myself,depression
989,I wake up feeling overwhelming regret.,depression
990,Is this a hidden state of depression?,depression
991,I’m not gonna be on here anymore and I wanted to be dramatic,depression
992,Catch 22,depression
993,I feel as though I am out of options,depression
994,I need help,depression
995,Convincing Parent who don't believe depression ( the mental illness) is a mental illness,depression
996,Will I ever feel like life was worth it?,depression
997,"Last night one of the most humiliating, weirdest horrible things happened to me at a wedding...",depression
