,title,subreddit
0,NHS health care..told I don’t need further help..,depression
1,I just want to end it,depression
2,Sort of a random question but how bad is it if parents have been physically n mentally abuse their own child who also have autism?,depression
3,I feel nothing,depression
4,im fucking stupid,depression
5,Motivation?,depression
6,I went to a mental hospital for a week and it saved my life.,depression
7,My father is abusive and I have no way of getting my own house,depression
8,I have everyone’s issues.,depression
9,How to put your past life in the right perspective?,depression
10,everybody is fake,depression
11,I am already dead.,depression
12,What to do all day?,depression
13,First time seeing a psychiatrist but I’m high asf,depression
14,The Feeling of Complete Uncertainty,depression
15,Not Wanting to Exist,depression
16,"I don't want to work a typical ""first job"" because I think it would exacerbate my depression. I want to go to college mainly to make friends and be with people my age but I don't know what to study.",depression
17,I’m failing at everything I do and I can’t cope anymore.,depression
18,I feel like I’ve wasted my whole year being sad.,depression
19,2nd post this week. I am done feeling forgotten,depression
20,A break from life is all I need,depression
21,Just want to end it tonight,depression
22,Seeing a psychotherapist for the first time,depression
23,I had coffee with a girl this morning,depression
24,What else do I need to do to improve how I'm feeling?,depression
25,Any subs for spousal support,depression
26,What goes up must come back down,depression
27,I feel like I've lost everything.,depression
28,It has gotten worse once again,depression
29,Is listening to sad music okay or should you just cut it all out? :/,depression
30,I need help,depression
31,Can't bring myself to seek help about literally anything wrong with me,depression
32,Depression and work!,depression
33,I have finally been able to talk to someone about how I feel.,depression
34,"I have brainwashed myself to escape from the pain. As a result, I am doing literally nothing but putting efforts in avoidance. Anyone?",depression
35,Need advice regarding taking SSRIs for depression and anxiety,depression
36,Soon to be in debt from failing scholarship obligations.,depression
37,Experiences taking Viibryd,depression
38,Just going outside worked wonders for me,depression
39,Really good read about passive suicidal thoughts. I thought I was the only one.,depression
40,Yoga!,depression
41,"I Wish i could open up a little more, i always keep everything inside",depression
42,Chasing hapoines is fools quest,depression
43,Why can’t I ever look good?,depression
44,I don't know what I feel anymore...,depression
45,i'll never have sex in my life,depression
46,Depression stole most of my teenage life and i’m afraid i’m going to stay like this,depression
47,WTF is up with me???,depression
48,I can't do this anymore,depression
49,What if I don't want to be happy?,depression
50,Im screwing up everything,depression
51,I wonder..,depression
52,Send help and advice,depression
53,What warning signs do you notice that signal you're slipping back into a depressive episode?,depression
54,Depression is as much worse when you live alone,depression
55,I think when my friends ask me to come hangout with them that it’s out of pity.,depression
56,What it’s like in a Psych Ward:,depression
57,Helped me more than meds 23F,depression
58,I can't wait for my appointment with my psychiatrist. I'm going to see him on the next week after 2 years of break.,depression
59,It's getting hurt really bad,depression
60,It is so hard for me to get out of bed and go to work....,depression
61,"I want to kill myself, but I don’t know if I should.",depression
62,Im Giving myself until 7/1/2021,depression
63,We can do it :),depression
64,i'm tired of life,depression
65,Sad because alone. Alone because sad,depression
66,Pills aren't working,depression
67,Today is a better day,depression
68,What small steps you take to reverse the negative thought-spirals?,depression
69,"Woke up, felt like crap. Back to bed.",depression
70,Doings.,depression
71,How do you live when you have to work?,depression
72,Today is my birthday,depression
73,Constant Mood Swings...,depression
74,"Made myself a childhood deal that if things didn't improve by 25, I'd kill myself. I'm 24 now and I think I'm ready.",depression
75,How tired do you feel after feeling depressed?,depression
76,I genuinely wish i wasnt born.,depression
77,The one realization that cured my depression,depression
78,Decades of solitude,depression
79,The rigged game of life,depression
80,I'm sick of everything.,depression
81,Confused,depression
82,"does anyone else feel like they’re in a trance, of sorts? as if they’re just floating through life - which feels intangible in itself - with very little or no purpose?",depression
83,Do you ever get depressed from being a social person?,depression
84,Optimistic for no reason?,depression
85,Suicidal since 12.,depression
86,My instability in my weird life. [Rant?],depression
87,I think the i found out why i have depresion.,depression
88,New here.,depression
89,My mom told me that my depression is god’s way of punishing her,depression
90,Jealousy,depression
91,This subreddit is fucking trash and does the opposite effect for me,depression
92,I don't remember how to take care of myself.,depression
93,I hate myself,depression
94,How to deal with the family?,depression
95,Please help me worldbuilding is all that keeps me alive,depression
96,Is it better to end myself？,depression
97,I'm desperate,depression
98,i give up,depression
99,I realize now why I deeply disliked some people.,depression
100,How should I approach therapy?,depression
101,How can I cope with the fear of been bullied?,depression
102,If I could give all my good health and years of my life away I would.,depression
103,Right when things were starting to get a little better,depression
104,Strange feeling that everything is meaningless,depression
105,My story so far which I just need to get out into the world.,depression
106,Life feels so directionless and empty,depression
107,Starting work might give me the push to kill myself,depression
108,Why can't i just be fucking normal,depression
109,"For anyone who needed someone to listen, I am here.",depression
110,Icarus,depression
111,Is it worth checking into a mental hospital?,depression
112,Waiting for your counsellor to email back.,depression
113,How to last?,depression
114,Feelin' Like I'm Experiencing Some Kind of Crisis Right Now!? What to Do?,depression
115,25yo f looking for some comfort,depression
116,Can you just snap out of depression?,depression
117,Having absolutely no one that cares makes it all not worth it at all,depression
118,The pain,depression
119,Forever in pain,depression
120,HIRING &gt; A KILLER,depression
121,Need help getting rid of anger and hate.,depression
122,Conquering my depression has been the chief motivation force in my life lately,depression
123,I hate celebrations.,depression
124,"antidepressants don't help, therapy isn't what's helping me get better, and i'm almoat to the point which i don't care if my mom gets very sad if i KMS",depression
125,I don't want to exist anymore...,depression
126,How many feel and know of their utter uselessness?,depression
127,"Haven't slept in 2 days, Depressed. Help please",depression
128,the good old 7 O' Clock,depression
129,I've been feeling nothing.,depression
130,About to lose my job,depression
131,How to deal with guilt and shame and learn to forgive myself?,depression
132,"""If at first you don't succeed. Give up and fucking quit!""... That's how I feel right now",depression
133,RIP Dad.,depression
134,idk kind of about religion so..,depression
135,Friends only want to hangout when it's convenient for them or need a favor. They tune me when I try to reach out and constantly ditch me for the S.O. I want to be normal like them. Suicidal thoughts looming....,depression
136,Screaming into the void,depression
137,Giving up on life???,depression
138,Having sex doesn't cut it anymore,depression
139,It’s so confusing,depression
140,"I am wanting life to ""go faster"". Has anyone else experienced this?",depression
141,I’m done,depression
142,yeet,depression
143,its almost time...,depression
144,I'm too fucking poor to go to college and I might have to drop out again.,depression
145,Does anyone remember the last time they were happy?,depression
146,Would anyone recommend cutting themselves?,depression
147,nobody cares...,depression
148,Aaaaaaaaaaaaaaaaaaaaaah,depression
149,Never felt more alone then I do rn,depression
150,I had to put my dog down today.,depression
151,Had a rough weekend,depression
152,Your mental illness explains your actions but it doesn’t justify them,depression
153,Had to put my dog down last Friday.,depression
154,Just need someone to talk to.,depression
155,Being ugly is one of the worst things in the world,depression
156,I became the abuser.,depression
157,my existenial post college job search crisis,depression
158,I just wish I could disappear from the world,depression
159,How can I not give in to self harm?,depression
160,I decided to post another poem,depression
161,Depression is my superpower,depression
162,I tried to numb the pain with alcohol for the 1st time,depression
163,Feeling a little numb,depression
164,I'm on my last legs.,depression
165,i’m so very confused,depression
166,Out,depression
167,I feel like I have no past.,depression
168,hallucinating right after waking up?,depression
169,I'm not sure where to go.,depression
170,My third suicide attempt was a failure too.,depression
171,Isolation.,depression
172,"ranting, rambling, thoughts at 3am",depression
173,"I just got up, looked in the mirror and saw my pimble covered ugly ass face. I don't want to get out.",depression
174,Sometimes I want to be left alone...,depression
175,"are these ""symptoms"" anything I should be concerned about?",depression
176,Social media usage linked to depression and low self esteem.,depression
177,Probably no one will read but here I go,depression
178,(':,depression
179,"One thing that kept me ""alive"" is gone now",depression
180,So I thought about it,depression
181,Severe OCD which also causes depressive thoughts.,depression
182,I'm not having fun anymore,depression
183,Realising how lonely I am and what friends I actually have!,depression
184,Ah fuck i got blood over my feet and they wont stop bleeding,depression
185,I cannot reach out to others or let anyone in.,depression
186,Just need someone to know,depression
187,When does this get better?,depression
188,One thing that kept me from being complete mess just disappeared,depression
189,I'm so touched starved I feel myself loosing it,depression
190,The Cycle,depression
191,It's been a rough start to the week and I still have 4 days to go...,depression
192,I truly am at the absolute bottom,depression
193,Barely keeping the facade up,depression
194,[Venting] I was doing so well...,depression
195,Depression vs sadness,depression
196,its seeping into my dreams and it sucks,depression
197,"Tired. Exhausted of feeling ""broken"" and I keep pushing people away.",depression
198,How I cope,depression
199,Sweet revenge,depression
200,[rant] 10 years ago was my first real suicide attempt.,depression
201,Depression &amp; anxiety creeping back in,depression
202,At My wits end with life.,depression
203,Today was good,depression
204,Anonymous post,depression
205,First time taking sertraline,depression
206,What I thought when I was deppressed,depression
207,The man who sexually assaulted me two days ago sent me a friend request on Facebook,depression
208,"I’m not mad, I’m just disappointed in myself.",depression
209,How do I tell my sister I was having thoughts of killing myself after she graduated,depression
210,This sub is toxic and you should be careful on it...,depression
211,Psychic visions?,depression
212,am i starting to get depressed?,depression
213,I just don't see a reason to go on...,depression
214,My little sister committed suicide.,depression
215,I hate my life,depression
216,I'm having trouble with staying positive,depression
217,My will to live is fucking gone,depression
218,How to socialize again after years of isolation?,depression
219,Distract me,depression
220,Question about diagnosis.,depression
221,I don’t want to exist anymore.,depression
222,"Does anybody else ever feel like they are unworthy of their desires, and/or incapable of attaining their goals?",depression
223,I found this sub today. Now I feel guilty for calling myself depressed.,depression
224,Nausea from unresolved emotions?,depression
225,What’s the first step?,depression
226,I'm suicidal again. I'm terrified. (TW: general idea of suicide),depression
227,Currently crying in bed,depression
228,Knowing I need help and actually getting help are two different things,depression
229,Birthday depression.,depression
230,"Depressed grad student, I can't see the light at the end of the tunnel.",depression
231,I feel like my life is falling apart,depression
232,"B.A. &amp; M.Ed., good career, had to take medical leave due to MDD and burnout. Now ECT and having memory issues. No idea what I will be able to do with my life now.",depression
233,Anyone else with Treatment Resistant Depression ?,depression
234,Can you guys please motivate me to not like a guy that treats me like SHIT AGAIN????,depression
235,Im finishing highschool this year but I feel like I learnt nothing...,depression
236,Why don't people care until I do something drastic/extreme?,depression
237,Relatable illustration about depression on 🐦,depression
238,I feel emotional empty.,depression
239,i miss my friends,depression
240,"I don't know exactly why, but I had a strong urge today to write down things that were going through my mind...I hope it could be an encouragement.",depression
241,"When Someone asked you to truly describe your depression, what did you say?",depression
242,the people who you think care about you will be the first ones to leave,depression
243,Feeling really bad and loney atm out alone at 5 am,depression
244,Just woke up with feeling that im about to die,depression
245,I'm confused,depression
246,I want to quit my job but my parents won't let me,depression
247,Some nights,depression
248,hey. Im new to this and expressing my feelings to strangers.,depression
249,I’ve been doing ‘so good’ but really I am just so alone and right now I want to die more than ever,depression
250,Ten years and 4 kids later my gf left me for another guy.,depression
251,Depression is scary,depression
252,Does anyone else wake up depressed?,depression
253,"I may have ruined my relationship, but I finally reached out for help.",depression
254,Unfollowed the kid from my high school who killed himself,depression
255,Anyone hate that logic destroys your reason for being depressed?,depression
256,Idk,depression
257,When will it end,depression
258,How do I stop feeling like I’m worthless,depression
259,I don't feel right saying I have depression.,depression
260,"I don't know why, and I'm sorry.",depression
261,Strange feeling?,depression
262,I went to the gym today,depression
263,I’ve not felt this awful in months.,depression
264,How to stop being oversensitive?,depression
265,Sinking down to nowhere,depression
266,"No one to talk to, no one to trust",depression
267,It’s back again.,depression
268,Team No Sleep?,depression
269,Does anyone else feel like they're having an existential crisis every day?,depression
270,Am I asking too much?,depression
271,Can't drink even a single beer and makes me feel like an outcast in social situations,depression
272,Change,depression
273,I’m my biggest demon.,depression
274,Today was my birthday.,depression
275,please tell me about your animals,depression
276,All human are scums,depression
277,Packing to move,depression
278,Anyone else relate?,depression
279,i am not,depression
280,i just cut again,depression
281,Laughter?,depression
282,I hope someones having a better day then me.,depression
283,i felt joy today!! i’m gaining positivity everyday!,depression
284,Fuck this place,depression
285,Im so bored but dont want to do anything. I want to wake up early but cant and dont want to sleep.,depression
286,Does anyone else deal with the weird urge to violently rip off your own skin?,depression
287,Weird.,depression
288,Im worthless.,depression
289,My last “friend” just ghosted me,depression
290,My mother has clinical depression on and off for 4 years and refuses to return to a doctor. Please help.,depression
291,I guess I’m a fuckup.,depression
292,what can i do?,depression
293,Question: Is it normal to get a extremely sad nostalgia feeling from events that happened not to long ago?,depression
294,Just posting cause something just happened and I need to vent.,depression
295,We can help,depression
296,"Depression relapse soon, I can feel it",depression
297,Just sad.,depression
298,Depression is bad and working makes it worse (venting),depression
299,Tips for low cost therapy in CA,depression
300,I dont want to go out anymore :(,depression
301,I’m really getting hopeless about depression,depression
302,Getting more and more suspicious about people.,depression
303,tonight is worrysome,depression
304,Just nothing,depression
305,Each day it's getting harder to keep it in.,depression
306,"I have 40 sleeping pills at the ready and I literally don't know why I just don't take them because honestly I enjoy nothing anymore and nobody really cares about me so like why live you know? I just want this nightmare to end, but it never ends, never.",depression
307,My old best friend who I cut off years ago invited me to his wedding this past weekend and I ended up having one of the best days/nights of my life. (long post),depression
308,how can I help,depression
309,So tired of life,depression
310,Questions about Viibryd,depression
311,A friend of mine took his life.,depression
312,No one cares about me enough to seek my company or hang out.,depression
313,I feel like being in a relationship and being loved will cure my depression.,depression
314,Has anyone pushed away a spouse due to depression?,depression
315,Feel so ashamed,depression
316,Nobody cares about this,depression
317,"I’m always sad, or angry, or anxious and I don’t have insurance",depression
318,5:33 am,depression
319,Is there such thing as a road to recovery and what does it look like?,depression
320,"I have no mouth, but I must scream",depression
321,My experience with depression.,depression
322,I feel so alone.,depression
323,Parenting with severe depression,depression
324,Having a crush when you’re depressed is fuckin horrible lol,depression
325,Another low day,depression
326,My friends forgot about me again today.,depression
327,Fed up as fuck,depression
328,I told my closest friend I was dealing with Depression,depression
329,I’m having an episode and it suuuuuuuuuuuuuuuuuuucksssss,depression
330,Trying to get out seems to backfire.,depression
331,Trying to overcome a major depressive episode,depression
332,Is this all just a bad dream?,depression
333,Coping,depression
334,I have tried for the better part of a month to be more positive and energetic around other people but...,depression
335,I don’t know what to do anymore.,depression
336,Does anyone else here know they are completely fucked and going to die some form of awful death?,depression
337,Not sure.,depression
338,Are these symptoms?,depression
339,Adult female. No friends. Socially isolated,depression
340,"Just lost gf of 7 yrs, suicidal",depression
341,Therapy for depression related guilt,depression
342,Help,depression
343,Having depression while living with our parents is so fucking hard,depression
344,Help if you can. I hope you find the help you need in whatever way that is.,depression
345,Trying to keep it light and fluffy today depression humour.,depression
346,"As much fun as I have sometimes with my fiancee, I still miss having friends to spend time with",depression
347,I read posts about people who grew up and didn’t do anything,depression
348,So a man goes to see his financial advisor...,depression
349,My best friend moved away and I can't stop crying.,depression
350,Giving up on life :'(,depression
351,I'm scared of my own mind,depression
352,I don't know what to do And I Fucking hate it,depression
353,"Depressed boyfriend left me, has anyone been through the same and they finally came around?",depression
354,Depressed in my 40s.,depression
355,"Rant: Everyone is ""There For You"" Until You Need Them To Be",depression
356,Make therapy free for Australian youth suffering with mental health issues,depression
357,I get so sad when I look at successful people,depression
358,I just get in this mood where I'm just not interested in anything at all,depression
359,I'm so fucking done.,depression
360,short poem,depression
361,One of those nights where my mind wont slow down and all I want to do is get away physically but I cant .... help,depression
362,Relationship,depression
363,Stuck in a toxic job and I am getting sick,depression
364,What is going on with me?,depression
365,I'm a massive failure,depression
366,i feel lost for the past 3.5 years,depression
367,i truly feel like i’m not good at anything,depression
368,Inhale-,depression
369,I have a folder on my computer,depression
370,Too many vices!,depression
371,"Depression, MCAT, and how I’m (failing) to get out of it by myself",depression
372,Why Should I Continue Living? 💀 Here Are 10 Reasons (2019),depression
373,I tried to jump,depression
374,"I was babysitting a 7 year old girl today, she watched a movie the day before with some sort of suicide seen (not sure what movie) and she asked why someone would wanna kill themselves",depression
375,I'm want it to end,depression
376,I just need a hug,depression
377,Every fucking day,depression
378,I'm a waste of time and resources.,depression
379,Dear God. Please make me not wake up tomorrow.,depression
380,why doesn't anyone like me? I'm so alone :( what's the point,depression
381,I feel lost and terrified.,depression
382,How do you even explain the feeling of hopelessness,depression
383,How do I get new friends.,depression
384,Where do you draw the line.,depression
385,Take Care of a Broken Soul (Vent Poem #3),depression
386,Ruining everything,depression
387,i hate going out and love it at the same time,depression
388,I am in the break room at work and I accept that I don’t have what it takes,depression
389,I'm afraid this is it. I need help and I don't know what to do.,depression
390,Poetry to Help my Depression - 8# - The man in his castle.,depression
391,"Can anyone that has/is taking Wellbutrin for depression tell me what it made you feel like the first few weeks. I just started taking it, and I don’t know how to feel about it",depression
392,It's harder to cope when you live by yourself,depression
393,does anybody else get spurts of motivation and interests..,depression
394,The hardest question: What is your dream? What is your goal? What do you wanna do in your life?,depression
395,I’ve already tried to kill my self yesterday and failed what do I do now?,depression
396,Think I need to go back to my psychiatrist,depression
397,My life is a fucking uphill battle,depression
398,how to quit a job for mental health reasons?,depression
399,Making it to retirement?,depression
400,why are my dreams normal ?,depression
401,A Positive Thought a Day: For the Anxious &amp; Depressed by Deidra Hall,depression
402,My I am successful in my career (somewhat) but never having dated anyone has damaged my self esteem.,depression
403,Was this a normal hospital experience?,depression
404,I’m exhausted and dying,depression
405,lexapro fried my fucking brain,depression
406,Everyone says I'm attention seeking and no one will help me,depression
407,Dont see any future...still here cuz i dont want to hurt my parents or friends,depression
408,I hate my life,depression
409,Depression,depression
410,The reasons to not live are piling up real high,depression
411,I can’t form bonds with anyone. Something is very wrong with me.,depression
412,WhY lABeL ThIs !,depression
413,I fail at absolutely everything and I don't know what to do,depression
414,I don't know what to do anymore,depression
415,Psychedelic trip epiphany,depression
416,Mom told me she had hard six months,depression
417,The Astronaut,depression
418,need some comforting words,depression
419,What to do when you feel like you've exhausted your loved ones and you can't get therapy just yet?,depression
420,I feel tired,depression
421,What do I do,depression
422,"Hello, I don't know if I am depressed, but...",depression
423,I have been depressed for about six years and have not told my parents. I’m glad I haven’t.,depression
424,Suicide is the only thought that consoles me,depression
425,How Long Should An Episode Last?,depression
426,My friend calls me fat and ugly,depression
427,Absolutely Shit Day...,depression
428,Does anyone else have (for lack of a better term) “despair climaxes?”,depression
429,My fucking father just said i’m selfish and think only about myself.,depression
430,I'm out of time and low on choices.,depression
431,I feel so fucking god damn alone.,depression
432,Problem with fake depression,depression
433,"Feeling sad and depressed feels so comfortable and “good”. But in reality it doesn’t feel comfortable or good, I’m just used to it.",depression
434,I'm here to help.,depression
435,I'm getting more depressed,depression
436,"Everytime I'm asleep it's like I'm in some far-away place and at peace. Then when I wake up the first thought that goes through my head is always ""Oh FUCK, back to THIS again""",depression
437,Cant see a way forward.,depression
