,title,subreddit
438,Don't see any point in keeping up with anything.,depression
439,I wish to lose my mind,depression
440,My boyfriend has depression and my mom didn’t like it.,depression
441,SSRI vs SNRI,depression
442,quick vent about drugs sorry,depression
443,empty lol!,depression
444,DAE Feel like you deserve to feel this way?,depression
445,Uni,depression
446,Nothing Works,depression
447,"I don't feel sad or destroyed anymore, but I lost interest in everything",depression
448,help,depression
449,It's not too late...,depression
450,Has this happened to you guys?,depression
451,I always think people dislike me,depression
452,Does anybody here experience the same thing?,depression
453,Need to talk to someone,depression
454,Do I have salvation? Passing through horrible things lately (Inside myself).,depression
455,Gonna try to beat this,depression
456,"I always reminisce about the past, I never enjoy the present, and then when the present is gone, I miss it",depression
457,I stopped caring,depression
458,How do I help myself?,depression
459,I can't take it anymore *trigger warning*,depression
460,Im a 27 year old who is ready to call it quits,depression
461,progression,depression
462,My depression is ruining my relationship,depression
463,Where do I go to talk to someone that isn’t a suicide hotline?,depression
464,I have come to the conclusion,depression
465,"How University finished breaking me (please read, I need to feel heard)",depression
466,I decided to do something with myself this summer,depression
467,"I'm going off zoloft, feeling symptoms of withdrawal?..",depression
468,HELP! My boyfriend says he wants to kill himself,depression
469,I cant fucking enjoy anything anymore and it hurts so bad,depression
470,I feel like since I have such recurring depression that I'm not as entitled to help as others.,depression
471,privileged and depressed,depression
472,I feel like people are lying to me when they say that having a SO doesn’t make their depression any better,depression
473,Nobody ever invites me anywhere,depression
474,When summer vacstion turns from fun to hell,depression
475,I feel extremely sad,depression
476,I just need some support,depression
477,Had a dream that’s got me worried,depression
478,I just feel so lost,depression
479,Does anyone ever feel like a burden when making a doctor appointment?,depression
480,"Organized, goal-oriented lifestyle is so difficult",depression
481,The hostility and negativity I see on the internet makes me feel like the earth is a shitty place...,depression
482,Going for a walk,depression
483,I don’t know what to do,depression
484,The struggles of waking up,depression
485,I am just so tired,depression
486,Has anyone chatted with any national suicide prevention line?,depression
487,My depression is making me physically ill.,depression
488,my suicidal thoughts and my doctor,depression
489,The real question,depression
490,"Anyone else here is ""dumb""?",depression
491,Why does it feel like people around me are tired of my depression,depression
492,It's exactly like being mentally crippled,depression
493,Don't know what to do,depression
494,More depressed when physically sick?,depression
495,How do I open up to my boyfriend about depression and codependency in a non-selfish way?,depression
496,I feel like I've spent my whole life being depressed and haven't actually done anything.,depression
497,"It hurts, too much",depression
498,Should I switch therapists?,depression
499,Why the hell does my birthday make me so depressed?,depression
500,Poetry to help my Depression - #21 - Quiet House,depression
501,I'm Done,depression
502,Flashes,depression
503,I hate myself,depression
504,I think I made it,depression
505,So fucking depressed. Do nothing all day. Have zero social connections outside of school (I'm off for summer).,depression
506,I want to live. I dont want my friends and family to live without me.,depression
507,CBD for depression?,depression
508,I have reached a stage where I am in control of my depression and anxiety. Here are some tips that I hope will be useful,depression
509,Depression is worst if you don't live alone. But anxiety is better.,depression
510,"For my summer vacation,I’m going to bed",depression
511,I feel really bad at a camp and I don't know what to do.,depression
512,I just wanted to be happy,depression
513,Seems like people only care about themselves,depression
514,Having a hard time,depression
515,r/wholesomememes,depression
516,Anyone else just completely burnt-out from job hunting?,depression
517,The only person i love is in love with someone else,depression
518,Failed college,depression
519,I get tattoos to cure my depression.,depression
520,When will it get better,depression
521,I went to the shooting range and I felt as free as ever.,depression
522,Wi-Fi,depression
523,Depression vs my dreams,depression
524,The Importance of our Digital Well-Being for our Mental Health and Happiness,depression
525,So lost and don't know how to climb out,depression
526,"No matter how hard I try, I can't stop hating myself for the time I've wasted.",depression
527,To anyone who needs to hear this today,depression
528,Just when you think you are getting better...,depression
529,I am numb,depression
530,What’s wrong with me,depression
531,I fucked up my own life and now I'm stuck,depression
532,I'm never having children.,depression
533,"Just give me a fucking chance, I’m begging.",depression
534,I skipped work,depression
535,"Hello, for now",depression
536,Everyone around me just reminds me how I’m worthless,depression
537,"It's been 5 days since my birthday, i do happy at first but become gradually more stressed and it getting harder and harder everyday",depression
538,Careers for a depressed recluse?,depression
539,Getting better didn't make things better.,depression
540,How to stop crying?,depression
541,I [24F] from Toronto am going down a path of loneliness and isolation,depression
542,I just to let it out,depression
543,i’m so happy today!!,depression
544,Really sucks to know that there are teenagers that are way more successful than me doing the exact same things I dream to do,depression
545,My mom thinks im shit and now I wanna kill myself,depression
546,My student told me I looked depressed today,depression
547,"I finally managed to give an exam after 2 years of not having the strength to study it, but I don't feel any better then usual.",depression
548,How do you let go of the past?,depression
549,I have been a mess for a while now.,depression
550,19 year old college student on summer break. About to start my 2nd year and I'm extremely scared.,depression
551,Friends hate me. Any advice?,depression
552,Serious question for everyone: how do you guys get energy?,depression
553,My new struggle,depression
554,"Anyone got kind of lost with discipline after moving out? I don't even eat dinners anymore, just some bread with salami.",depression
555,DBT TREATMENT CENTRES,depression
556,I don't know what going on with me,depression
557,My family says I look like Tom Holland and it makes me so happy inside,depression
558,Help me..,depression
559,Just wanting to get this off my chest,depression
560,When people call you lazy..,depression
561,Help me stop feeling this way :(,depression
562,Does anyone else obsess over things to distract themselves.,depression
563,Only really just realised that I might be depressed,depression
564,Anyone Else Feel Like Life is Passing Them By? I'm Turning 43 Soon...,depression
565,"I am gonna do this for the first time. I hear about people cutting their wrists, and I am gonna try too!",depression
566,I hate feeling down for no reason at all.,depression
567,most of the people in my life know I'm depressed but haven't talked to me about it,depression
568,Can antidepressants work quickly?,depression
569,Depression Strikes Back,depression
570,"""Support from peeps""",depression
571,Using dreams,depression
572,Today marks one year since my fathers passing.,depression
573,Red alert!,depression
574,"Applying for disability in America, what to expect?",depression
575,"unemployed, diagnosed with depression",depression
576,Does anyone experience brief moments of happiness and then fall directly back into depression?,depression
577,reddit is making me realise that there are a lot of sad people out there. thats really sad in itself,depression
578,"Overwhelmed, alone and getting worse.",depression
579,Being an awkward teenager in your 30s.,depression
580,Is it weird that seeing teenagers hang out on a Summer day can be one of the highlights of my day?,depression
581,I keep obsessing on my mental health but I don't think I'm actually doing anything that is helpful,depression
582,My feelings aren't important.,depression
583,DAE just not give a fuck anymore?,depression
584,Pristiq side effects,depression
585,is it still worth it...,depression
586,Where do I go from here?,depression
587,question,depression
588,"Everyday, I want to tear myself apart.",depression
589,I feel envious I see my friends posting how successful they are in life.,depression
590,"I've come far, but always being tired is nothing I can win",depression
591,how do you go about maintaining friendships without energy?,depression
592,Experience with Mirtazapine (Remeron) and weight gain,depression
593,I don't know when I'll be okay,depression
594,I think i fucked up,depression
595,The Hard Truths,depression
596,Just because youre happy doesnt mean sadness leaves you,depression
597,having to work through a mental breakdown,depression
598,Today I read about a semi ramming into a car and killing a mother and her two kids.,depression
599,Sometimes I wish..,depression
600,Does anyone else just lose the will to live sometimes?,depression
601,My Brain Has Mental Fog,depression
602,I cant function much anymore.,depression
603,everyone in my family has a bright future except me,depression
604,Starting to relapse back into a depression mental state and I’m unsure of what to do.,depression
605,"Please say something, anything.",depression
606,Always happy for others but never for myself,depression
607,Losing hope,depression
608,I can't take life anymore (long post warning),depression
609,"is it normal being depressed because you can't get out as you want, your only chance to get out is with your family only wearing a specific black clothes with your face coverd to a specific places like a restaurant or the beach- you can't swim you just sit and watch it- or to school or work only?",depression
610,i feel lonely and messed up by having brown parents,depression
611,Being happy isn't a choice,depression
612,Doggie help?,depression
613,Getting a job when you don't want to exist?,depression
614,Can’t sleep.,depression
615,I'm an empty shell.,depression
616,"Weed, depression, getting a job",depression
617,Lifes heavy everyday,depression
618,"Sleep was my only escape, and now one of my biggest nightmare..",depression
619,i wanna die i'm just not sure how to,depression
620,Feeling so alone,depression
621,Does anyone care more for you family and friends than you do for yourself and then eventually realize they don’t care as much as you thought?,depression
622,Poetry to help my Depression - #20 - Clean,depression
623,I can’t even tell what’s real anymore. And I’m starting to not care.,depression
624,"I'm getting too tired to hate and, I'm afraid of the day I can't any longer.",depression
625,I don’t know how to feel real emotions anymore.,depression
626,I had another breakdown and I can't ask for help,depression
627,I don't know why I'm here,depression
628,I went to hang myself again this weekend,depression
629,"I don’t want to die, but I think about it all the time.",depression
630,"I'm not ok. There, I said it.",depression
631,"Have been consistently going to the gym for the past month. I look better, muscular even, but I feel the exact same way mentally, full of emptiness, exhaustion and devoid of emotion",depression
632,It just keeps getting worse,depression
633,Long read... Need to finally get this off my chest,depression
634,Relapsing depression,depression
635,"Nobody ever looks at a mentally ill person and think “wow they are my type, they were definitely worth the effort and trial.”",depression
636,Does anyone else feel like their friends aren't really their friends?,depression
637,I'm tired of feeling incompetent,depression
638,Life’s fucked,depression
639,8 months out of a break up,depression
640,I’m so sad and have been alone my entire life.,depression
641,Really unsure whether this post will help,depression
642,I learned how to make a noose,depression
643,I’m afraid of losing my friends,depression
644,After arguing with my parents once again they have decided to go see a therapist,depression
645,I hate myself,depression
646,Day 3 of me forcing myself to exercise.,depression
647,I'm fucked,depression
648,"I never thought I'd post here but enough is enough. Any advice would be helpful, thank you.",depression
649,The current time is 2:19 am. I drank way too much tonight. This is my diary entry. Names changed so she doesn’t find this post,depression
650,Please don’t judge me and tell me my life is okay.,depression
651,"I’m never just fine, it’s either over the top happy or crying nonstop",depression
652,"Just need someone to talk to, that’s it.",depression
653,I did the things.,depression
654,Being right does not make me feel better,depression
655,So I got help (it helped a bit),depression
656,"So there's this song I really like by Fool's Garden called ""Lemon Tree""",depression
657,Get proper sleep guys,depression
658,My kids saved my life,depression
659,I feel completely emotionless.,depression
660,Loosing people,depression
661,The Light at the End,depression
662,Manic episodes are the worst part of depression for me,depression
663,"Please help, my mother is suicidal and I don’t know how to help her.",depression
664,Does anyone else get really annoyed when someone tells you 'Maybe you shouldn't be taking all that medication.'?,depression
665,Is it okay to disappear?,depression
666,I've never wanted to hurt myself,depression
667,I don't know what to do,depression
668,Can growing up in the wrong environment permanently ruin your expectations?,depression
669,Just got out of hospital and still feel eh,depression
670,I (19F) feel so hopeless in what seems like a never ending job search.,depression
671,Is there a light at the end of the tunnel?,depression
672,Anyone else get a disaster everytime things starts to sort of going in your favor?,depression
673,does anyone else feel like they get bullied all the time?,depression
674,Vitamin D,depression
675,It hurts so bad,depression
676,Vent,depression
677,I Don’t know if I wanna live or die,depression
678,I need some advice,depression
679,Sad....,depression
680,"ECT starting in a week, getting pretty nervous...",depression
681,don’t want to be better???,depression
682,Scared about not having any relationships.,depression
683,Hard Night need to vent,depression
684,Am I justified in being angry at others?,depression
685,is it just me,depression
686,I’m literally so tired of myself,depression
687,I cut myself pretty badly and I don't know what I feel.,depression
688,Need Help - Maladaptive Day Dreaming - Lack of Productivity - Depression,depression
689,How to get help despite hatred and distrust toward mental health professionals.,depression
690,Nearly died and didn't care,depression
691,Everything about life makes me so unhappy,depression
692,Lost in a dark place,depression
693,"Doc prescribed Lamotrigine/Lamictal, results seem varied to positive?",depression
694,Turning 20,depression
695,1st shower in 1 month,depression
696,I question for you guys about depression,depression
697,No one has wished me on my birthday,depression
698,"I was a gifted, bright child, and then around middle school got existential dread and wanted to kill myself, still do at 20",depression
699,I miss so many things in my life.,depression
700,I want to go home...but I dont know where home is,depression
701,Everything wrong with me,depression
702,I’m scared,depression
703,It Had Finally Happened,depression
704,How does one achive happiness when they're completely and helplessly stuck in a fog of mental illness.,depression
705,Honestly don’t know where to begin,depression
706,I absolutely can't take it anymore.,depression
707,"I can't afford my medication, having to quit cold turkey... I need help.",depression
708,First post trying to get stuff off my chest and using this as an outlet,depression
709,My mom supports my brother bullying me.,depression
710,Will the gym actually help?,depression
711,Can't stop sleeping,depression
712,Not trusting friends/family,depression
713,"Fitness, Self Care or Self Harm [RANT]",depression
714,Who am I,depression
715,I just want to cry,depression
716,"""What's depression like""?",depression
717,Friend,depression
718,Taking medication,depression
719,Imagine that alternate universe,depression
720,I won’t drink anymore,depression
721,Struggling for a bit.,depression
722,My wife was admitted via the Backer Act today. How can I help her?,depression
723,Coping with depression,depression
724,My school is hurting my mental health.,depression
725,I feel like a horrible person. But I'm not. You have to be a little selfish sometimes.,depression
726,"I'm scared, I'm 18 year old and have never dated",depression
727,What is this happenning to me?,depression
728,"Can’t sleep , thinking too much",depression
729,What's your dosage Wellbutrin SR?,depression
730,Depressed and confused,depression
731,I can’t believe I pulled myself out of bed for this shit...,depression
732,I just need someone who’s company I enjoy.,depression
733,I feel like such a failure that I seriously can't breath. I don't know what to do.,depression
734,i cry myself to sleep every night,depression
735,I'm gonna snap.,depression
736,I am pissing off everyone I meet.,depression
737,Cant seem to get a break,depression
738,Fuck it. I’m just gonna kill myself after high school,depression
739,Dealing with grief.,depression
740,I'm paying someone in weed to shoot me,depression
741,Finding release,depression
742,Things didnt get better...,depression
743,Just broken.,depression
744,I think I need help.,depression
745,Life lost,depression
746,Does anyone else just feel emotionally dead?,depression
747,"Need advice sticking to routine, staying alone and learning to say no",depression
748,death drive,depression
749,Feel like life isn't going to get better from now,depression
750,Exhausted myself out of suicide for tonight.,depression
751,It's so weird seeing depression in its physical form.,depression
752,I want Therapy /meds but can’t afford it.,depression
753,Existence feels overrated.,depression
754,Did you lose weight after stopping medication and counting calories?,depression
755,"Whenever someone says they are depressed and begin a sentence with ""...and my SO...""",depression
756,I'm tired of this,depression
757,this sucks,depression
758,Yesterday I did a deep clean of my living space for the first time in 2019 and I gotta say cleaning and clearing clutter has tremendously improved my mood.,depression
759,"I’m going to do it, I’m going to end it all",depression
760,No hope for anything,depression
761,I'm related to the person who psychologically abused me.,depression
762,When someone extends a hand to help you up reach out and accept it. It might be the defining moment of your life.,depression
763,GetMotivated is just saccharine garbage,depression
764,I don’t know why I feel this way,depression
765,I couldn’t do it anymore,depression
766,weight gain,depression
767,My mothers noticed I've been down.,depression
768,Problems with road trips,depression
769,I feel trapped and I'm hurting my family,depression
770,I dont know what to do anymore,depression
771,I think I’m going crazy and I need serious help!,depression
772,what do you do when your asian parents call you fat?,depression
773,how do I make a cry for help,depression
774,Never thought I would say this but... (A case for telling your truth),depression
775,The worse dream in my life (until now),depression
776,I hate my life. It has to change or I'll end it myself.,depression
777,I just went for my first counselling session,depression
778,Still Trudging Forward,depression
779,Terrified to open Exam Results Email,depression
780,Feels so weird pretending everything is fine,depression
781,Realizing happiness can't last :(,depression
782,I told my ex that I’m suicidal,depression
783,Advice?,depression
784,What are some challenges to come?,depression
785,Faith in humanity is bs,depression
786,Hiding depression from family because sibling already has a mental condition,depression
787,Guys I need help,depression
788,How do I stop,depression
789,I'm Just Tired,depression
790,Never over,depression
791,Sad again,depression
792,"My depression will be manageable soon, but right now, it’s unbearable.",depression
793,I dunno what to do.,depression
794,My life is getting worse.,depression
795,I need advice,depression
796,"Unsure if i'm depressed, but I don't know what to do.",depression
797,I feel guilty Everytime I see my parents,depression
798,"Feeling like giving up, so done",depression
799,Fuck life,depression
800,What is wrong with me?,depression
801,I think we were all destined to be great,depression
802,DAE feel even worse when eating?,depression
803,I'm 97% sure I'm not gonna kill myself but I cant stop thinking about it and it doesn't let me sleep,depression
804,what is happening ?,depression
805,Everything is bad here’s why,depression
806,"I can’t stop crying (23, m)",depression
807,Some dumb rant.,depression
808,Im tired of everything.,depression
809,Which would you rather have?,depression
810,"First Time, Long Time",depression
811,Does anybody else joke about their depression because It helps them deal with it?,depression
812,(TMI?) How do you deal with your period during a depressive episode?,depression
813,"I'm a mess that does everything wrong, yet I don't care.",depression
814,Finally got help today,depression
815,Some advice,depression
816,lost a friend tw,depression
817,"This may not be considered a “win”, but to me it is",depression
818,Im drunk as fuck and tired of being tired,depression
819,Sometimes life is good,depression
820,i had one of the best days of my life,depression
821,I hate myself,depression
822,Is being tired ALL the time really a symptom? Or is there something else going on,depression
823,Every little bit helps.,depression
824,How do you deal with loneliness and being single in general?,depression
825,I will always be lonely,depression
826,Life has turned meaningless,depression
827,Does Anyone else feel scared that there friends hate them?,depression
828,Scared of living alone,depression
829,Moving back Home,depression
830,I should end it.,depression
831,Worthless piece of shit,depression
832,Seeing a psychiatrist alone underage,depression
833,My story so far,depression
834,Does anyone else get brief manic episodes when stressed and then crash?,depression
835,Saviour,depression
836,I'm so shitty to everyone. Why am I like this,depression
837,Valid reason for suicide (?),depression
838,"I feel like I might have depression, but I’m also scared of seeing a therapist",depression
839,I'm going to be alone for the rest of my life,depression
840,I honestly don’t like most people,depression
841,Just looking for a place to say this,depression
842,Opening up to people in my life has never helped me,depression
843,"Tried to kill myself and failed, what do I do now?",depression
844,What encourages you to stay in touch with friends when you are depressed or/and when you just don't want to,depression
845,Anyone else beginning to lose their appetite?,depression
846,Lonley and feeling the drag...,depression
847,Life has never been good and will never get better.,depression
848,I am nobody.. and i dont want to be anybody,depression
849,Many things I want to get out of my head but still will chase me,depression
850,Right place to post?,depression
851,Found out my crush found someone else. I honestly don't want to keep going on anymore.,depression
852,Hypothetical,depression
853,Light's,depression
854,Getting rid of social media - that isn't Reddit!,depression
855,"Why do some people seem to matter more, and get much more love, than others?",depression
856,I feel like depression has ruined my friendships.,depression
857,Losing friends.,depression
858,it's hypocrisy day again.,depression
859,I need some advice,depression
860,Worst summer I ever had,depression
861,I’m fed up with fighting,depression
862,I hate myself.,depression
863,The company I work for is a shit show and it makes me even more miserable.,depression
864,Bursts of Energy???,depression
865,Creeping,depression
866,Fuck this shit,depression
867,When your not normal you have to spend huge amounts of energy acting like you are,depression
868,Summer of fun my ass,depression
869,"I'm so tired, what's the point",depression
870,We f**ked up with you.,depression
871,Baby fever hurts.,depression
872,Googling suicide methods brings me comfort,depression
873,Antidepressant withdrawal rant!!,depression
874,After 5 years I’ve given up,depression
875,Being adult is fucking sucks,depression
876,I don't want to die today,depression
877,The small steps,depression
878,"I'm tired of being alone, and it's all I have to look forward to.",depression
879,I feel like im stuck in a endless cycle of pain,depression
880,What is not being depressed like?,depression
881,How can I stop being a burden to my friends and family?,depression
882,"Fellow depressed people, what are some things you do that make your days a little more tolerable?",depression
883,I just want to cry.,depression
884,How do I explain to my parents about my depression?!,depression
