,title,subreddit
0,SpaceX delays Starhopper's first flight a few days despite Raptor preburner test success,technology
1,Facebook Clashes With Congress Over Its ‘Dangerous’ Cryptocurrency Plans,technology
2,Tech giants brace for Washington showdown in echo of Bill Gates - BNN Bloomberg,technology
3,Renewable Energy Is Now The Cheapest Option - Even Without Subsidies,technology
4,I lived like a moon astronaut and have the scars to prove it,technology
5,Permission-greedy apps delayed Android 6 upgrade so they could harvest more user data,technology
6,Sprint says hackers breached customer accounts via Samsung website,technology
7,Twitter users in Canada will now be able to hide their replies to tweets,technology
8,An Open Letter to the FTC on Google’s Banning of Repair Business Ads - iFixit,technology
9,Memory chip prices soar as South Korea-Japan dispute escalates,technology
10,Hackers steal millions of Bulgarians' financial records: tax agency,technology
11,AI solves Rubik's Cube in one second,technology
12,"The Watch That Went to the Moon: Fifty years ago, Buzz Aldrin wore his Omega Speedmaster Professional on the lunar surface. It’s been an icon—and a bestseller—ever since.",technology
13,Amazon offering shoppers $10 to track websites they visit,technology
14,"""We Could Have Lost the Apollo 11 Crew"": A Once-Classified Anomoly Nearly Killed NASA's First Moon Astronauts",technology
15,Cyberattacks inflict deep harm at technology-rich schools,technology
16,EFF Hits AT&amp;T With Class Action Lawsuit for Selling Customers’ Location to Bounty Hunters,technology
17,"Tesla drops ‘Standard Range’ Model S and Model X, lowers prices of ‘Long Range’ variants and Model 3",technology
18,Facebook vows Libra currency will wait for approval as U.S. airs worries,technology
19,SentiArt: a sentiment analysis tool for profiling characters from world literature texts,technology
20,Facebook’s Libra Hearings In Congress Are The Best Free Entertainment You’ll Get All Week,technology
21,Ajit Pai’s new gift to cable companies would kill local fees and rules,technology
22,"To Break Google's Monopoly On Search, Make Its Index Public - Slashdot",technology
23,Amazon offers $10 to Prime Day shoppers who hand over their data,technology
24,"Tesla drops cheapest Model X, S variants, cuts prices to simplify lineup",technology
25,Smart meters go Welsh: latest glitch changes language on devices more than 100 miles from the border,technology
26,Social Media Evolution (Infographic),technology
27,Computer Scientists Make the Case Against an Expensive New Voting System - Georgia is preparing to spend $150 million on election technology. Experts worry it will be a security nightmare.,technology
28,Big tech behemoths face grilling from US lawmakers as hearings kick off,technology
29,Silicon Valley’s Right Wing Is Angry And Punching Back,technology
30,"Elon Musk’s brain-interface company is promising big news. Here’s what it could be. We think Neuralink, which develops brain-machine interfaces, is recording from the neurons of monkeys as a stepping stone toward humans.",technology
31,Technology beating romanticism at Tour de France,technology
32,"Tesla employees say they took shortcuts, worked through harsh conditions to meet Model 3 production goals",technology
33,Cryptocracy: A Discussion of how Crypto Could Affect Governance,technology
34,Ajit Pai’s new gift to cable companies would kill local fees and rules,technology
35,"Cryptocurrencies Pose National Security Threat, Mnuchin Says",technology
36,"Google, Apple, Amazon and Facebook at Congress antitrust hearing: How to watch",technology
37,"Facebook snags former Vine GM to run product for its new experimental app division, NPE Team",technology
38,Don’t Scoff at Influencers. They’re Taking Over the World.,technology
39,Facebook’s real goal with Libra is to become even more of a utility,technology
40,How to fight a war in space (and get away with it),technology
41,Epic Games supports Blender Foundation with $1.2 million,technology
42,"Verizon has the fastest and best network, study reveals.",technology
43,"Thinner than hair, two ultra-thin flexible chips have been developed by Chinese researchers. The two chips can amplify the analog signals and integrate the processor with Bluetooth wireless communication function, respectively",technology
44,"Founder of neo-Nazi site Daily Stormer should pay $14 million to victim of 'troll storm,' judge says",technology
45,Security reports reveal how Assange turned an embassy into a command post for election meddling,technology
46,Microsoft Quantum Algorithm Boosts Medical Imaging,technology
47,SpaceX finally reveals cause of April spacecraft explosion,technology
48,How do I convince my 80-something year old grandma to use the internet?,technology
49,"Computers Can Now Bluff Like a Poker Champ. Better, Actually. A new artificial intelligence program is so advanced at a key human skill—deception— that it wiped out five human poker players with one lousy hand",technology
50,"U.S. proposes barring big tech companies from offering financial services, digital currencies - Reuters",technology
51,Machine learning has been used to automatically translate long-lost languages,technology
52,A Feisty Google Adversary Tests How Much People Care About Privacy,technology
53,"It’s Time For Oakland To Join the List of Cities Banning Facial Recognition (And Berkeley, too).",technology
54,Twitter says Trump’s tweet didn’t violate its rules against racism but won’t say why,technology
55,House Democrats are considering a bill to ban Facebook from the finance industry,technology
56,Knowing the “Value” of Our Data Won’t Fix Our Privacy Problems,technology
57,What is post-quantum cryptography? - MIT Technology Review,technology
58,Apollo 11 Had a Hidden Hero: Software,technology
59,Google Accused of Ripping off Digital Ad Technology in U.S. Lawsuit,technology
60,"Open Markets Submits Brief to Congress on Facebook Libra Currency Risks, Calls on Congress to Block Libra",technology
61,"Before Being Hacked, Border Surveillance Firm Lobbied to Downplay Security and Privacy Concerns About Its Technology",technology
62,US Treasury has 'serious concerns' that Facebook-backed cryptocurrency Libra could be used for terrorism,technology
63,Original Apollo 11 Guidance Computer (AGC) source code for the command and lunar modules.,technology
64,Twitter is changing Twitter.com to be more like mobile app,technology
65,"To Break Google’s Monopoly on Search, Make Its Index Public.",technology
66,"On Prime Day, Amazon workers and immigrants rights organizations are protesting | 'The biggest employee-led one is happening in Shakopee, Minn., where Amazon warehouse workers protesting the working conditions, pay, benefits and general culture'",technology
67,New face of the Bank of England's £50 note is revealed as Alan Turing,technology
68,Colleges expect to graduate 10K data scientists this year. It's one of Amazon's top occupations,technology
69,Waymo Wants to Help People Get Their Work Done While Riding in a Self-Driving Taxi,technology
70,Samsung seeks patent on folding AR glasses with frame-activated screen,technology
71,Google’s new ‘data echoing’ technique speeds up AI training,technology
72,Cordless vacuum doubles up as a MOP and lasts for an hour on a single charge,technology
73,Office 365 declared illegal in German schools due to privacy risks,technology
74,"‘Google is not a patriotic company,’ says co-founder of data-mining company Palantir",technology
75,Computer password inventor dies aged 93,technology
76,Scotland just produced enough wind energy to power all its homes twice over,technology
77,Europe’s GPS alternative has been offline since Friday,technology
78,"Ready or not, here comes the new Twitter",technology
79,How many kinds of USB-C™ to USB-C™ cables are there?,technology
80,Waze now shows road toll prices along your driving route,technology
81,Scotland just produced enough wind energy to power all its homes twice over,technology
82,A Feisty Google Adversary Tests How Much People Care About Privacy,technology
83,Samsung to prepare contingency plans for Korea-Japan trade scuffle,technology
84,England will be the first country in the world to introduce mandatory electric car charging points for new-build homes,technology
85,Alexandria Ocasio-Cortez ‏joins chorus of facial recognition critics,technology
86,How Attackers Are Circumventing Your Best Defensive Measures,technology
87,Thousands of Amazon workers across Europe and the US are striking and protesting on Prime Day,technology
88,How Moon-Landing Tapes Found in a $218 Batch Could Fetch $1 Million,technology
89,"Social media, but not video games, linked to depression in teens, according to landmark Montreal study",technology
90,"U.S. proposes barring big tech companies from offering financial services, digital currencies",technology
91,This Flaw Could Have Allowed Hackers to Hack Any Instagram Account Within 10 Minutes,technology
92,Cambridge Uni graphene spin-out bags $16M to get its first product to market,technology
93,An IT security salesman told me his software doesn't work A random encounter with a professional reveals the inherent issues with IT security.,technology
94,"Peter Thiel slams Google's 'seemingly treasonous' links to China, which he says should be investigated in a 'not excessively gentle manner'",technology
95,French Inventor Totes Rifle While Flying Turbine-Powered Flyboard at Bastille Day Celebrations,technology
96,Invasion of the electric scooter: can our cities cope?,technology
97,Alan Turing: WWII codebreaker revealed as new face of £50 note,technology
98,DCMS urged to make porn privacy scheme compulsory,technology
99,Open letter to DCMS - BBFC Age Verification Privacy Certification Scheme,technology
